id,type,link,cleaned_text
14,website,https://www.occ.gov/topics/consumers-and-communities/consumer-protection/fraud-resources/mortgage-fraud.html,"Mortgage Fraud | OCC Skip to main content An official website of the United States government Careers Quick Access Most Requested Bank Secrecy Act (BSA) Contact Us Community Reinvestment Act (CRA) Comptroller's Handbook Corporate Application Search Enforcement Action Search Financial Institution Lists Newsroom Third-Party Relationships: Interagency Guidance on Risk Management More OCC Websites BankNet.gov Find resources for bankers. HelpWithMyBank.gov Get answers to banking questions. Careers.occ.gov Join one of the best places to work. Search More Search Tools Financial Institution Search CRA Performance Evaluations Search Enforcement Actions Search Corporate Applications Search (CAS) Home Topics Consumers & Communities Consumer Protection Fraud Resources Mortgage Fraud Share This Page: This is fraud targeting homeowners, often through misleading terms or fraudulent loan applications. Mortgage fraud involves deceit or misrepresentation in the origination or funding of a mortgage loan. How It Works Mortgage fraud target individuals looking for home loans or financial assistance. Fraudsters may offer misleading or deceptive loan terms, demand upfront fees, or promise help with a foreclosure in exchange for payment, but they never deliver on these promises to help. Common Methods of Mortgage Fraud Foreclosure rescue scams: Scammers charge upfront fees with false promises to save the home from foreclosure. Loan modification scams: False promises to modify loans or reduce mortgage payments. Predatory lending: Lenders offer loans with high fees, abusive terms, or hidden charges. Warning Signs Promises to modify or refinance your mortgage for an upfront fee. Unsolicited offers to help you avoid foreclosure or to secure a new mortgage loan at rates that seem too good to be true. Pressure to sign documents immediately without giving you time to read or review them. Requests for personal or financial information, like bank account details or Social Security numbers, in the context of obtaining a mortgage loan, without any legitimate reason. Incorrect details on mortgage loan applications, artificially high property appraisals, identity theft during mortgage transactions, or scams that aim to steal equity from your home. Ways to Avoid It Work with trusted lenders: Only work with lenders that are accredited and registered with the government. Never pay upfront fees for loan modification help: Legitimate loan modification programs donât require you to pay in advance. Get everything in writing: Donât sign anything until you fully understand the terms and have had time to review the documents. Seek U.S. Department of Housing and Urban Development (HUD) approved counseling for information about your mortgage loan payment options: If youâre facing foreclosure, contact a HUD-approved housing counseling agency for assistance. Monitor your credit reports Obtain free credit reports from AnnualCreditReport.com. Regularly review your credit reports for any unauthorized inquiries or accounts, suspicious activities, or errors. Ways to Report It Taking prompt and comprehensive actions when faced with mortgage fraud can help mitigate any potential damage and ensure that the fraudsters are reported to the proper authorities. Report suspicious activity to relevant federal agencies and to your state and local consumer protection agencies. Online: Determine which agency regulates your bank and file a complaint. Report to the Internet Crime Complaint Center (IC3) Online: Submit a complaint to the IC3, a division of the FBI. This is especially useful for internet-related crimes. Report the fraud to the Federal Trade Commission (FTC) Online: Visit ReportFraud.ftc.gov to file your complaint. Phone: Call the FTC at 1-877-FTC-HELP (1-877-382-4357) if you prefer to file your complaint over the phone. Inform your mortgage lender Notify your current mortgage lender or the financial institution involved in the mortgage loan transaction about the fraudulent activity. Remember: Stay vigilant and always verify the authenticity of communications from unknown sources. Learn More Mortgage Fraud fact sheet, part of the OCCâs Safe Money series Top Tasks Fight Back Against Identity Theft Apply for a Free Annual Credit Report Get answers to questions and file a complaint at HelpWithMyBank.gov"
15,website,https://www.occ.gov/topics/consumers-and-communities/consumer-protection/fraud-resources/online-and-digital-scams.html,"Online and Digital Scams | OCC Skip to main content An official website of the United States government Careers Quick Access Most Requested Bank Secrecy Act (BSA) Contact Us Community Reinvestment Act (CRA) Comptroller's Handbook Corporate Application Search Enforcement Action Search Financial Institution Lists Newsroom Third-Party Relationships: Interagency Guidance on Risk Management More OCC Websites BankNet.gov Find resources for bankers. HelpWithMyBank.gov Get answers to banking questions. Careers.occ.gov Join one of the best places to work. Search More Search Tools Financial Institution Search CRA Performance Evaluations Search Enforcement Actions Search Corporate Applications Search (CAS) Home Topics Consumers & Communities Consumer Protection Fraud Resources Online and Digital Scams Share This Page: Online and digital fraud occurs via the internet, often through deceptive emails, websites, or messages that trick people into providing personal information or money. How It Works Online and digital scams occur when fraudsters use the internet to trick people into revealing personal information or sending money. These scams often come in the form of phishing emails, fake websites, or fraudulent online shopping schemes. Common Methods of Online and Digital Scams Fake e-commerce sites: Fraudsters set up fake websites to sell products that are never or only partially delivered after payment is made. Phishing: Emails or text messages that look like theyâre from legitimate companies, asking victims to click a link and enter sensitive information. Tech support scams: Fraudsters pose as tech support representatives, claiming a computer virus needs immediate fixing, often gaining access to the victimâs device. Warning Signs Unsolicited emails or texts asking you to click on a link or provide personal information. Phishing emails: Emails that appear legitimate but are designed to steal personal information. These emails usually include spelling and grammar errors and use generic greetings rather than your name. Fake websites: Websites that mimic legitimate sites to capture your personal or financial data. These sites usually include slight misspellings in the domain name and have outdated logos. Online shopping scams: Non-existent goods/services after payment. Investment/loan scams: Promises of high returns or favorable loans that are fraudulent. Offers that seem too good to be true, such as winning a prize or getting a product for a significantly discounted price. Receiving a message from a friend or contact that is unusual or suspicious, potentially indicating their account has been hacked. Requests for remote access to your computer, often under the guise of fixing a problem. False receipts received via email showing your purchase of software, such as anti-virus software, in the hopes you will contact them. Ransomware/malware: Malicious software that cuts off access to your own data or device and demands a ransom to regain access to your data or device. Ways to Avoid It Avoid clicking on suspicious links: Do not click on links or download attachments from unknown sources, especially in unsolicited emails or texts. Use strong security software: Ensure your devices are protected by up-to-date antivirus and anti-malware software. Verify before providing personal information: Always verify the legitimacy of websites and emails before entering sensitive information. Enable two-factor authentication: Use two-factor authentication (2FA) on all your online accounts to add an extra layer of protection. Monitor your credit reports Obtain free credit reports from AnnualCreditReport.com. Regularly review your credit reports for any unauthorized inquiries or accounts, suspicious activities, or errors. Ways to Report It Online and digital fraud includes phishing, tech support scams, and fake e-commerce sites designed to steal personal information or money. Taking prompt and comprehensive action when faced with debt collection fraud can help mitigate any potential damage. Report the scam to the Federal Trade Commission (FTC) Online: Visit ReportFraud.ftc.gov to report the scam. Provide as many details as possible about the interaction. Phone: Call the FTC at 1-877-FTC-HELP (1-877-382-4357) if you prefer to file your complaint over the phone. Report to the Internet Crime Complaint Center (IC3) Online: Submit a complaint to the IC3, a division of the FBI. This is especially useful for internet-related crimes. Report to your local law enforcement Local law enforcement: Visit or contact your local law enforcement agency to report the scam. Cybercrime units: Some law enforcement agencies have specialized cybercrime units. Notify Additional Federal Agencies (if applicable) Securities and Exchange Commission (SEC): If it involves investment fraud. Online: sec.gov Phone: 1-800-SEC-0330 Federal Communications Commission (FCC): For telecommunication scams. Online: fcc.gov/complaints Phone: 1-888-225-5322 U.S. Postal Inspection Service (USPIS): For mail-related scams. Online: uspis.gov Phone: 1-877-876-2455 Report to Social Media and Online Platforms Social media: Report fraudulent activities to social media platforms. Shopping sites: Contact customer service or use reporting tools on legitimate websites. Payments platforms: If payment was made through a payment service, report the incident immediately to their customer support. Alert Your Financial Institutions Notify your bank, credit card companies, or any financial institutions involved. Request a replacement of any affected cards and monitor your accounts for unauthorized transactions. Remember: Always remain vigilant and proactive in protecting your financial information. Learn More Online and Digital Scams fact sheet, part of the OCCâs Safe Money series Top Tasks Fight Back Against Identity Theft Apply for a Free Annual Credit Report Get answers to questions and file a complaint at HelpWithMyBank.gov"
16,website,https://occ.gov/news-issuances/bulletins/2024/bulletin-2024-19.html,"Anti-Money Laundering and Countering the Financing of Terrorism Program Requirements: Notice of Proposed Rulemaking | OCC Skip to main content An official website of the United States government Careers Quick Access Most Requested Bank Secrecy Act (BSA) Contact Us Community Reinvestment Act (CRA) Comptroller's Handbook Corporate Application Search Enforcement Action Search Financial Institution Lists Newsroom Third-Party Relationships: Interagency Guidance on Risk Management More OCC Websites BankNet.gov Find resources for bankers. HelpWithMyBank.gov Get answers to banking questions. Careers.occ.gov Join one of the best places to work. Search More Search Tools Financial Institution Search CRA Performance Evaluations Search Enforcement Actions Search Corporate Applications Search (CAS) Home News & Events Newsroom OCC Bulletin 2024-19 | July 19, 2024 Anti-Money Laundering and Countering the Financing of Terrorism Program Requirements: Notice of Proposed Rulemaking Share This Page: ToChief Executive Officers of All National Banks, Federal Savings Associations, and Federal Branches and Agencies; Department and Division Heads; All Examining Personnel; and Other Interested Parties Summary On July 19, 2024, the Office of the Comptroller of the Currency, the Board of Governors of the Federal Reserve System, the Federal Deposit Insurance Corporation, and the National Credit Union Administration (collectively, the agencies) issued a joint notice of proposed rulemaking that would amend the requirements that each agency has issued for its supervised banks, currently referred to as Bank Secrecy Act (BSA) compliance programs, to establish, implement, and maintain effective, risk-based, and reasonably designed anti-money laundering (AML) and countering the financing of terrorism (CFT) programs. The amendments align with changes that are being concurrently proposed by the Financial Crimes Enforcement Network (FinCEN) as a result of the Anti-Money Laundering Act of 2020 (AML Act). The agencies and FinCEN are also issuing a joint statement that describes their proposed rules and the additional steps necessary to implement the AML Act. Note for Community Bank The proposed amendments would apply to all national banks and all federal savings associations, including community banks. Highlights The notice of proposed rulemaking would propose the following changes, among others: Incorporating a risk assessment process in AML/CFT program rules that would require, among other things, consideration of national AML/CFT priorities published by FinCEN. Including customer due diligence requirements to reflect prior amendments to FinCENâs requirements. Including amendments to codify longstanding supervisory expectations and conform to changes made by the AML Act. Encouraging, but not requiring, banks to consider, evaluate, and as appropriate, implement innovative approaches to meet compliance obligations pursuant to the BSA. Background Pursuant to the AML Act, FinCEN is amending its BSA compliance program rules to incorporate national AML/CFT priorities and other changes. The agencies have independent authority to prescribe regulations requiring banks to establish and maintain procedures reasonably designed to assure and monitor their compliance with the requirements of the BSA. The agencies are proposing to amend their rules concurrently with FinCEN. In 2016, FinCEN amended its AML compliance program rules to incorporate customer due diligence (CDD) requirements, adding beneficial ownership information collection requirements into FinCENâs AML compliance program rule for certain financial institutions, including banks. The proposed rule would add CDD as a required component of the agenciesâ AML/CFT program rules, which would mirror FinCENâs existing rule. Further Information Please contact Jina Cheon, Special Counsel; Melissa Lisenbee, Counsel; Priscilla Benner, Counsel; Scott Burnett, Counsel; or Henry Barkhausen, Counsel; Chief Counsel's Office, at (202) 649-5490. Theodore J. Dowd Acting Senior Deputy Comptroller and Chief Counsel Related Links Anti-Money Laundering and Countering the Financing of Terrorism Program Requirements (PDF) Interagency Statement on the Issuance of the AML/CFT Program Notices of Proposed Rulemaking (PDF) Topic(s): Bank Secrecy Act & Anti-Money Laundering (BSA/AML) Money Laundering"
17,website,https://occ.gov/topics/supervision-and-examination/bsa/index-bsa.html,"Bank Secrecy Act (BSA) | OCC Skip to main content An official website of the United States government Careers Quick Access Most Requested Bank Secrecy Act (BSA) Contact Us Community Reinvestment Act (CRA) Comptroller's Handbook Corporate Application Search Enforcement Action Search Financial Institution Lists Newsroom Third-Party Relationships: Interagency Guidance on Risk Management More OCC Websites BankNet.gov Find resources for bankers. HelpWithMyBank.gov Get answers to banking questions. Careers.occ.gov Join one of the best places to work. Search More Search Tools Financial Institution Search CRA Performance Evaluations Search Enforcement Actions Search Corporate Applications Search (CAS) Home Topics Supervision & Examination Bank Secrecy Act (BSA) Bank Secrecy Act (BSA) Share This Page: The OCC prescribes regulations, conducts supervisory activities and, when necessary, takes enforcement actions to ensure that national banks have the necessary controls in place and provide the requisite notices to law enforcement to deter and detect money laundering, terrorist financing and other criminal acts and the misuse of our nation's financial institutions. BSA/Anti-Money Laundering (AML) Examinations The OCC conducts regular examinations of national banks, federal savings associations, federal branches, and agencies of foreign banks in the U.S. to determine compliance with the BSA. BSA & Related Regulations The Bank Secrecy Act (BSA), 31 USC 5311 et seq establishes program, recordkeeping and reporting requirements for national banks, federal savings associations, federal branches and agencies of foreign banks. The OCC's implementing regulations are found at 12 CFR 21.11 and 12 CFR 21.21. The BSA was amended to incorporate the provisions of the USA PATRIOT Act which requires every bank to adopt a customer identification program as part of its BSA compliance program. BSA Law Enforcement Tools and Resources In addition to utilizing information filed by banks in money laundering and terrorist financing investigations, U.S. law enforcement also provides banks with access to resources and tools such as those listed here that can be used to strengthen your BSA/AML risk management programs. BSA/AML Bulletins, Financial Crimes Enforcement Network (FinCEN) Advisories, & Related BASEL Information The OCC and the U.S. Department of Treasury periodically issue alerts, advisories and rulemakings concerning institutions or individuals who may be engaged in fraudulent activities or be deemed to be of high-risk for money laundering or terrorist financing activities. BSA/AML Innovative Industry Approaches & Other Related Links The Office of the Comptroller of the Currency (OCC), the Board of Governors of the Federal Reserve System, the Federal Deposit Insurance Corporation, the Financial Crimes Enforcement Network (FinCEN), and the National Credit Union Administration issued a statement encouraging banks to take innovative approaches to meet their Bank Secrecy Act/anti-money laundering (BSA/AML) compliance obligations and further strengthen the financial system against illicit financial activity. Counter-Terrorist Financing U.S. banks play a key role in combating the financing of terrorism by identifying and reporting potentially suspicious activity as required under the BSA. A number of resources are available to assist you in this effort. Money Laundering Criminals have long used money-laundering schemes to conceal or ""clean"" the source of fraudulently obtained or stolen funds. Money laundering poses significant risks to the safety and soundness of the U.S. financial industry. With the advent of terrorists who employ money-laundering techniques to fund their operations, the risk expands to encompass the safety and security of the nation. Through sound operations, banks play an important role in helping investigative and regulatory agencies identify money-laundering entities and take appropriate action. Under the Bank Secrecy Act (BSA) and related anti-money laundering laws, banks must Establish effective BSA compliance programs Establish effective customer due diligence systems and monitoring programs Screen against Office of Foreign Assets Control (OFAC) and other government lists Establish an effective suspicious activity monitoring and reporting process Develop risk-based anti-money laundering programs Suspicious Activity Reports (SAR) As of April 1, 2013, financial institutions must use the Bank Secrecy Act BSA E-Filing System in order to submit Suspicious Activity Reports. A financial institution is required to file a suspicious activity report no later than 30 calendar days after the date of initial detection of facts that may constitute a basis for filing a suspicious activity report. If no suspect was identified on the date of detection of the incident requiring the filing, a financial institution may delay filing a suspicious activity report for an additional 30 calendar days to identify a suspect. In no case shall reporting be delayed more than 60 calendar days after the date of initial detection of a reportable transaction. Under the Bank Secrecy Act (BSA), financial institutions are required to assist U.S. government agencies in detecting and preventing money laundering, such as: Keep records of cash purchases of negotiable instruments, File reports of cash transactions exceeding $10,000 (daily aggregate amount), and Report suspicious activity that might signal criminal activity (e.g., money laundering, tax evasion) An amendment to the BSA incorporates provisions of the USA Patriot Act, which requires every bank to adopt a customer identification program as part of its BSA compliance program. Links to Other Organizations' BSA Information Popular Links Bank Secrecy Act/Anti-Money Laundering: Customer Due Diligence and Beneficial Ownership Requirements for Legal Entity Customers Overviews and Examination Procedures Bank Secrecy Act/Anti-Money Laundering: Revised FFIEC BSA/AML Examination Manual Treasury publishes National Money Laundering and Terrorist Financing Risk Assessments Top Tasks Learn about other organizations and federal government agency efforts to combat money laundering and terrorist financing Related News and Issuances DateIDTitle 10/09/2025 OCC 2025-31 Bank Secrecy Act/Anti-Money Laundering: FinCEN Frequently Asked Questions on Suspicious Activity Reporting 09/08/2025 NR 2025-84 OCC Announces Actions to Depoliticize the Federal Banking System 06/27/2025 OCC 2025-15 Bank Secrecy Act/Anti-Money Laundering: Customer Identification Program Tax Identification Number Alternative Collection Method"
