id,type,link,cleaned_text
5,website,https://www.occ.gov/topics/consumers-and-communities/consumer-protection/fraud-resources/check-fraud.html,"Check Fraud | OCC Skip to main content An official website of the United States government Careers Quick Access Most Requested Bank Secrecy Act (BSA) Contact Us Community Reinvestment Act (CRA) Comptroller's Handbook Corporate Application Search Enforcement Action Search Financial Institution Lists Newsroom Third-Party Relationships: Interagency Guidance on Risk Management More OCC Websites BankNet.gov Find resources for bankers. HelpWithMyBank.gov Get answers to banking questions. Careers.occ.gov Join one of the best places to work. Search More Search Tools Financial Institution Search CRA Performance Evaluations Search Enforcement Actions Search Corporate Applications Search (CAS) Home Topics Consumers & Communities Consumer Protection Fraud Resources Check Fraud Share This Page: This fraud involves the unauthorized use of a personâs checks. How It Works Check fraud occurs when an unauthorized person uses someone elseâs checks, or images of a check, to make unauthorized purchases or withdrawals. Common Methods of Check Fraud Check fraud: Scammers steal, or forge checks to make unauthorized transactions. Check washing: Fraudsters alter or âwashâ legitimate checks with chemicals to erase the ink from a check to rewrite amounts and payees. Mail fraud: Defrauding others by sending or receiving fraudulent checks through the mail. Warning Signs Unfamiliar checking account transactions appear on your bank statements. Your bank notifies you of unauthorized account activity. You receive calls from your bank about checks you didnât write or transactions you didnât make. Someone unsolicited contacts you with a request to deposit a check for any reason, especially to make money on a limited time offer of any kind. You receive a check in the mail related to employment as a mystery shopper, personal assistant, or for being the winner of a prize. Ways to Avoid It Monitor your financial accounts regularly: Set up account alerts for all transactions and review your statements frequently for unauthorized charges or unusual and suspicious activity. Use black gel ink on checks: Black gel ink is highly resistant to check washing, a common scheme where chemicals are used to erase ink from a check to rewrite amounts and payees. Get mail promptly after delivery and avoid leaving mail in your mailbox overnight. When sending checks, consider using the letter slots in your post office to send mail. Be wary of sending money or any medium of payment to someone after taking a check from them for any reason. Scammers often claim overpayment or demand you send or wire money after they give you a bad check. Ways to Report It Taking prompt and comprehensive action when faced with check fraud can help mitigate any potential damage and ensure that the fraudulent charges are resolved effectively. Notify your financial institution Bank: Inform your bank about the fraudulent transaction. Dispute any unauthorized charges and consider requesting your account be closed and a new account opened. Report to the Internet Crime Complaint Center (IC3) Online: Submit a complaint to the IC3, a division of the FBI. This is especially useful for internet-related crimes. Report the fraud to the Federal Trade Commission (FTC) Online: Visit the FTCâs IdentityTheft.gov to report the theft and create a recovery plan. Phone: Call the FTC at 1-877-438-4338. U.S. Postal Inspection Service (USPIS): For mail-related scams. Online: uspis.gov Phone: 1-877-876-2455 File a report with law enforcement Local law enforcement: Visit or contact your local law enforcement agency to file a report about the fraud. Provide them with all relevant information and documentation. Obtain a copy of the law enforcement report to provide to your financial institutions and credit bureaus as needed. Remember: Always remain vigilant and proactive in protecting your financial information. Learn More Check Fraud fact sheet, part of the OCCâs Safe Money series Top Tasks Fight Back Against Identity Theft Apply for a Free Annual Credit Report Get answers to questions and file a complaint at HelpWithMyBank.gov"
6,website,https://www.occ.gov/topics/consumers-and-communities/consumer-protection/fraud-resources/consumer-product-and-retail-fraud.html,"Consumer Product and Retail Fraud | OCC Skip to main content An official website of the United States government Careers Quick Access Most Requested Bank Secrecy Act (BSA) Contact Us Community Reinvestment Act (CRA) Comptroller's Handbook Corporate Application Search Enforcement Action Search Financial Institution Lists Newsroom Third-Party Relationships: Interagency Guidance on Risk Management More OCC Websites BankNet.gov Find resources for bankers. HelpWithMyBank.gov Get answers to banking questions. Careers.occ.gov Join one of the best places to work. Search More Search Tools Financial Institution Search CRA Performance Evaluations Search Enforcement Actions Search Corporate Applications Search (CAS) Home Topics Consumers & Communities Consumer Protection Fraud Resources Consumer Product and Retail Fraud Share This Page: This fraud involves the purchase or sale of goods, often through deceptive marketing or counterfeit products. How It Works Consumer product and retail fraud involves scams related to the purchase and sale of goods. Fraudsters might sell counterfeit goods or use fake retail sites to steal money from consumers. Common Methods of Consumer Product and Retail Fraud Counterfeit goods: Selling fake or substandard products at high prices or selling high-end products at âtoo good to be trueâ prices. Online auction scams: Scammers lure buyers with fake auction listings and collect payment without delivering the item. Retail return fraud: Individuals use various deceptive methods such as a false identity to return products for a refund, store credit, or exchange. Warning Signs Deeply discounted products or offers that seem too good to be true. Sellers who request unusual payment methods, like wire transfers, gift cards, or cryptocurrency. Little to no information about the sellerâs company, including no return policy or contact details. Receiving counterfeit goods or items that donât match the advertised product description. Misleading advertising: False claims about a productâs capabilities or features. Non-delivery of goods: Payment made but no product received. Warranty and return scams: Issues with a productâs warranty or return policy deception. Ways to Avoid It Research sellers: Only buy from reputable retailers and read customer reviews before making purchases. Be skeptical of deals: If a deal seems too good to be true, it likely is. Avoid offers that promise unusually low prices. Review return policies: Ensure the seller has clear return and refund policies and avoid purchasing from sites that lack transparency. Ways to Report It Fraudsters use counterfeit goods, online auction scams, and retail return fraud to deceive consumers into paying for products they donât receive or that are of inferior quality. Contact the seller or manufacturer Customer service: Reach out to the seller or manufacturerâs customer service to report the issue and seek resolution. Return policy: If applicable, use the return or exchange policy. Report the fraud to the Federal Trade Commission (FTC) Online: Visit ReportFraud.ftc.gov to report the fraud. Phone: Call the FTC at 1-877-FTC-HELP (1-877-382-4357) if you prefer to file your complaint over the phone. Report to the Internet Crime Complaint Center (IC3) Online: Submit a complaint to the IC3, a division of the FBI. This is especially useful for internet-related crimes. Alert online retail platforms E-commerce sites: If the product was purchased online, report the issue directly through the platformâs customer support or complaint system. Notify payment services (if applicable) If you paid through a payment service, report the issue to them for potential buyer protection and fraud investigation. Remember: Be sure to take the appropriate and effective steps to report and address consumer product and retail fraud. Learn More Consumer Product and Retail Fraud, part of the OCCâs Safe Money series Top Tasks Fight Back Against Identity Theft Apply for a Free Annual Credit Report Get answers to questions and file a complaint at HelpWithMyBank.gov"
7,website,https://www.occ.gov/topics/consumers-and-communities/consumer-protection/fraud-resources/credit-card-and-debit-card-fraud.html,"Credit Card and Debit Card Fraud | OCC Skip to main content An official website of the United States government Careers Quick Access Most Requested Bank Secrecy Act (BSA) Contact Us Community Reinvestment Act (CRA) Comptroller's Handbook Corporate Application Search Enforcement Action Search Financial Institution Lists Newsroom Third-Party Relationships: Interagency Guidance on Risk Management More OCC Websites BankNet.gov Find resources for bankers. HelpWithMyBank.gov Get answers to banking questions. Careers.occ.gov Join one of the best places to work. Search More Search Tools Financial Institution Search CRA Performance Evaluations Search Enforcement Actions Search Corporate Applications Search (CAS) Home Topics Consumers & Communities Consumer Protection Fraud Resources Credit Card and Debit Card Fraud Share This Page: This fraud involves the unauthorized use of a personâs credit card or debit card to make purchases or withdrawals. How It Works Credit card and debit card fraud occurs when a person uses someone elseâs card or card information to make unauthorized purchases or withdrawals. This can happen through physical theft of the card or by stealing card information online or through card skimming devices. Common Methods of Credit Card and Debit Card Fraud Account takeover: A fraudster takes control of a credit or debit card account to make unauthorized transactions. Card-not-present fraud: An unauthorized person uses stolen card details to make online purchases. Card skimming: Devices capture card information at ATMs or point-of-sale terminals, such as at gas pumps. Mail fraud: A scheme by a fraudster to intercept a credit or debit card from the mail before the intended account holder receives it. Phone thefts and fraud: Fraudsters target smartphones to access sensitive financial information, digital cards, banking apps, and wallets stored on the device. Warning Signs Unfamiliar credit or debit card transactions appear on your bank or credit card statements. Small dollar authorizations or transactions are used to âtestâ an account prior to much larger transaction activity. Your bank notifies you of unauthorized account activity. You receive calls from your bank about transactions you didnât make. Ways to Avoid It Monitor your financial accounts regularly: Set up account alerts for all transactions and review your statements frequently for unauthorized charges or unusual and suspicious activity. Use secure payment methods: When shopping online, ensure the website is secure (look for âhttpsâ in the URL) and avoid saving payment information on websites. Be cautious with ATMs and other point-of-sale terminals: Use ATMs located at secure, well-lit locations, and cover the keypad when entering your PIN to prevent skimming devices from capturing your information. Check if any parts of a point-of-sale terminal are loose or wiggle. Keep your cards secure: Never share your card details with anyone, and report lost or stolen cards immediately. Use strong passwords: Ensure all your online accounts have long, complex passwords and enable two-factor authentication where possible. Be sure all your online accounts have different passwords. Ways to Report It Taking prompt and comprehensive action when faced with credit card or debit card fraud can help mitigate any potential damage and ensure that the fraudulent charges are resolved effectively. Contact your card issuer immediately Phone: Call the customer service number found on the back of your credit or debit card or on the bankâs website. Report the fraudulent charges and request that your card be blocked or replaced. Online: Many financial institutions allow you to report fraud through their online banking or mobile app platforms. Consider requesting a new account. Place a fraud alert on your credit report Contact credit reporting agencies: Place a fraud alert on your credit reports by contacting one of the three major credit bureaus. The bureau you contact will inform the other two. Equifax: 1-800-525-6285 Experian: 1-888-397-3742 TransUnion: 1-800-680-7289 A fraud alert makes it harder for identity thieves to open accounts in your name. Duration: A fraud alert lasts for one year, but you can extend it. Report to the Internet Crime Complaint Center (IC3) Online: Submit a complaint to the IC3, a division of the FBI. This is especially useful for internet-related crimes. Report the fraud to the Federal Trade Commission (FTC) Online: Visit the FTCâs IdentityTheft.gov to report the theft and create a recovery plan. Phone: Call the FTC at 1-877-438-4338. U.S. Postal Inspection Service (USPIS): For mail-related scams. Online: uspis.gov Phone: 1-877-876-2455 File a report with law enforcement Local law enforcement: Visit or contact your local law enforcement agency to file a report about the fraud. Provide them with all relevant information and documentation. Obtain a copy of the law enforcement report to provide to your financial institutions and credit bureaus as needed. Remember: Always remain vigilant and proactive in protecting your financial information. Learn More Credit Card and Debit Card Fraud fact sheet, part of the OCCâs Safe Money series Top Tasks Fight Back Against Identity Theft Apply for a Free Annual Credit Report Get answers to questions and file a complaint at HelpWithMyBank.gov"
8,website,https://www.occ.gov/topics/consumers-and-communities/consumer-protection/fraud-resources/debt-collection-fraud.html,"Debt Collection Fraud | OCC Skip to main content An official website of the United States government Careers Quick Access Most Requested Bank Secrecy Act (BSA) Contact Us Community Reinvestment Act (CRA) Comptroller's Handbook Corporate Application Search Enforcement Action Search Financial Institution Lists Newsroom Third-Party Relationships: Interagency Guidance on Risk Management More OCC Websites BankNet.gov Find resources for bankers. HelpWithMyBank.gov Get answers to banking questions. Careers.occ.gov Join one of the best places to work. Search More Search Tools Financial Institution Search CRA Performance Evaluations Search Enforcement Actions Search Corporate Applications Search (CAS) Home Topics Consumers & Communities Consumer Protection Fraud Resources Debt Collection Fraud Share This Page: In this type of fraud, scammers impersonate legitimate debt collectors to scare consumers into paying debts that may not exist. Similar to imposter scams, this can involve fraudsters posing as government agents, such as the IRS, on uncollected debts. How It Works Debt collection fraud involves scammers impersonating legitimate debt collectors or creating fake debts to scare victims into paying money they donât owe. These fraudsters often use threats of legal action or arrest to force payments. Common Methods of Debt Collection Fraud Debt settlement scams: Fraudsters provide false promises to settle debts in exchange for upfront fees. Fake lawsuits or arrest claims: Fraudsters threaten consumers with lawsuits or arrest for unpaid debts to force payment. Phony debt collectors: Scammers demand immediate payment for fake or non-existent debts. Warning Signs Receiving calls or letters from debt collectors for debts you donât recognize or owe. Threats of arrest, legal action, or wage garnishment if payment isnât made immediately. Refusal by the caller to provide written verification of the debt. Demands for payment via wire transfers, prepaid cards, or gift cards. Ways to Avoid It Request written verification: Always ask for written proof of the debt from the lender or servicer before making any payments. Know your rights: Under the Fair Debt Collection Practices Act (FDCPA), you are entitled to dispute a debt and request verification. Do not share personal information: Never provide sensitive information, like your Social Security number or bank details, to unsolicited callers. Ways to Report It Scammers pretend to be legitimate debt collectors, often attempting to collect on non-existent or fake debts using threats or intimidation so it is important to take action to mitigate any potential damage and ensure that the fraudsters are reported to the proper authorities. Report to the Internet Crime Complaint Center (IC3) Online: Submit a complaint to the IC3, a division of the FBI. This is especially useful for internet-related crimes. Report the fraud to the Federal Trade Commission (FTC) Online: Visit ReportFraud.ftc.gov to report the fraud. Provide as many details as possible about the interaction. Phone: Call the FTC at 1-877-FTC-HELP (1-877-382-4357) if you prefer to file your complaint over the phone. Report to the Consumer Financial Protection Bureau (CFPB) or your state attorney generalâs office Report suspicious debt collectors: If you suspect a scam, report it to the CFPB or your state attorney generalâs office. Online: Submit a complaint through the CFPBâs complaint portal. Phone: Call 1-855-411-CFPB (1-855-411-2372). Report to local law enforcement If you believe you are dealing with a scammer or are being threatened, contact your local law enforcement agency to file a report. Place a fraud alert on your credit report Contact credit reporting agencies: Place a fraud alert on your credit reports by contacting one of the three major credit bureaus. The bureau you contact will inform the other two. Equifax: 1-800-525-6285 Experian: 1-888-397-3742 TransUnion: 1-800-680-7289 A fraud alert makes it harder for identity thieves to open accounts in your name. Duration: A fraud alert lasts for one year, but you can extend it. Remember: Being proactive and informed is crucial when dealing with debt collection fraud. Learn More Debt Collection Fraud fact sheet, part of the OCCâs Safe Money series Top Tasks Fight Back Against Identity Theft Apply for a Free Annual Credit Report Get answers to questions and file a complaint at HelpWithMyBank.gov"
9,website,https://www.occ.gov/topics/consumers-and-communities/consumer-protection/fraud-resources/types-of-consumer-fraud.html,"Consumer Fraud Awareness and Prevention | OCC Skip to main content An official website of the United States government Careers Quick Access Most Requested Bank Secrecy Act (BSA) Contact Us Community Reinvestment Act (CRA) Comptroller's Handbook Corporate Application Search Enforcement Action Search Financial Institution Lists Newsroom Third-Party Relationships: Interagency Guidance on Risk Management More OCC Websites BankNet.gov Find resources for bankers. HelpWithMyBank.gov Get answers to banking questions. Careers.occ.gov Join one of the best places to work. Search More Search Tools Financial Institution Search CRA Performance Evaluations Search Enforcement Actions Search Corporate Applications Search (CAS) Home Topics Consumers & Communities Consumer Protection Fraud Resources Consumer Fraud Awareness and Prevention Share This Page: Consumer fraud impacts millions of Americans every year and often results in financial harm. Learn about the most common types of consumer fraud, how each type works, the warning signs, and how to protect yourself and others. Check Fraud This fraud involves the unauthorized use of a personâs checks. Consumer Product and Retail Fraud This fraud involves the purchase or sale of goods, often through deceptive marketing or counterfeit products. Credit Card and Debit Card Fraud This fraud involves the unauthorized use of a personâs credit card or debit card to make purchases or withdrawals. Debt Collection Fraud In this type of fraud, scammers impersonate legitimate debt collectors to scare consumers into paying debts that may not exist. Elder Financial Exploitation Elder financial exploitation involves the theft or misuse of an older adultâs money, assets, or personal information. Financial and Investment Fraud This fraud involves deceitful practices to lure individuals into fake investments, often by promising returns that are too good to be true. Holiday and Gift Card Scams These scams tend to increase during the holiday season, targeting consumers by making false promises or engaging in fraudulent schemes involving gift cards. Identity Theft Identity theft occurs when someone illegally obtains and uses your personal or financial information without your knowledge, often leading to significant financial harm. Imposter Scams Imposter scams involve fraudsters pretending to be someone you trust, such as a government official or a company representative, to steal your money or personal information. Mortgage Fraud This is fraud targeting homeowners, often through misleading terms or fraudulent loan applications. Mortgage fraud involves deceit or misrepresentation in the origination or funding of a mortgage loan. Online and Digital Scams Online and digital fraud occurs via the internet, often through deceptive emails, websites, or messages that trick people into providing personal information or money. Top Tasks Fight Back Against Identity Theft Apply for a Free Annual Credit Report Get answers to questions and file a complaint at HelpWithMyBank.gov"
