id,type,link,cleaned_text
1,website,https://occ.gov/news-issuances/bulletins/2024/bulletin-2024-34.html,"Consumer Protection: Interagency Statement on Elder Financial Exploitation | OCC Skip to main content An official website of the United States government Careers Quick Access Most Requested Bank Secrecy Act (BSA) Contact Us Community Reinvestment Act (CRA) Comptroller's Handbook Corporate Application Search Enforcement Action Search Financial Institution Lists Newsroom Third-Party Relationships: Interagency Guidance on Risk Management More OCC Websites BankNet.gov Find resources for bankers. HelpWithMyBank.gov Get answers to banking questions. Careers.occ.gov Join one of the best places to work. Search More Search Tools Financial Institution Search CRA Performance Evaluations Search Enforcement Actions Search Corporate Applications Search (CAS) Home News & Events Newsroom OCC Bulletin 2024-34 | December 4, 2024 Consumer Protection: Interagency Statement on Elder Financial Exploitation Share This Page: ToChief Executive Officers of All National Banks, Federal Savings Associations, and Federal Branches and Agencies; Department and Division Heads; All Examining Personnel; and Other Interested Parties Summary The Office of the Comptroller of the Currency (OCC), the Board of Governors of the Federal Reserve System, the Consumer Financial Protection Bureau, the Federal Deposit Insurance Corporation, the Financial Crimes Enforcement Network, the National Credit Union Administration, and state financial regulators (collectively, the agencies), today issued a statement to provide institutions supervised by the agencies examples of risk management and other practices that can be effective in identifying, preventing, and responding to elder financial exploitation. Note for Community Banks The interagency statement applies to community banks.1 Highlights The interagency statement discusses developing effective policies and practices to better protect account holders and the institution. training employees on recognizing and responding to elder financial exploitation. using transaction holds and disbursement delays. establishing a trusted contact designation process for account holders. filing suspicious activity reports involving suspected elder financial exploitation. reporting to law enforcement and other appropriate entities. providing financial records to appropriate authorities. engaging with elder fraud prevention and response networks. increasing awareness through consumer outreach. Further Information Please contact Eric Ellis, Director for Bank Secrecy Act/Anti-Money Laundering Policy, at (202) 649-5470. Grovetta N. Gardineer Senior Deputy Comptroller for Bank Supervision Policy Related Link Interagency Statement on Elder Financial Exploitation 1 âBanksâ refers collectively to national banks, federal savings associations, covered savings associations, and federal branches and agencies of foreign banking organizations. Topic(s): Consumer Protection"
2,pdf,https://occ.gov/news-issuances/speeches/2024/pub-speech-2024-132.pdf,"Acting Comptroller of the Currency Michael J. Hsu
Remarks at the Women in Housing and Finance Public Policy Luncheon
“The Fraud Challenge”
December 11, 2024
The increasing prevalence of financial fraud presents a special challenge for us as a
society. While fraud does not have the profile of Basel 3 or cyber risk, its everyday impact in
people’s daily lives warrants attention. Fraud not only harms consumers, but also leads to distrust
in others, in institutions, and in the financial system. Effectively addressing this challenge is
going to require all stakeholders—from banks to social media platforms—to each pull their
weight and to act above and beyond what is currently legally required.
The situation reminds me of trash left on the street. I live in the city. Technically, litter
that is not on my property is not my concern. I have no obligation to pick it up. Neither do my
neighbors. And yet if no one picks up the errant bits of litter when they walk by, then more litter
tends to appear. Passersby feel it is OK to drop their wrapper on the ground or leave their empty
cup on the sidewalk when others have done so. Each act of littering and walking by litter is
relatively small. But the cumulative effect is palpable. The neighborhood becomes less nice, less
inviting, less orderly, less valued, and can even feel less safe. Over time, if left unaddressed, the
situation becomes accepted as normal.
The steady rise and pervasiveness of fraud today presents each stakeholder, including
regulators, with a choice. If everyone does only the minimum of what is legally required of them, consumers will continue to be harmed, people’s distrust in each other and in institutions will
continue to rise, and elevated levels of fraud will become normalized.
The most efficient and effective way to avoid this outcome would be for each and every
stakeholder to step up and do their part to combat fraud. This would mean getting in the habit of
leaning down and picking up the proverbial trash instead of just walking by it, even if doing so
isn’t legally required.
Fortunately, the banks I’ve spoken to about addressing fraud are open to this; many have
already begun to act.
First, I should note the importance of complying with existing laws and regulations to
promptly identify, investigate, and resolve fraud concerns, such as under the Expedited Funds
Availability Act (Regulation CC), and to address potentially unfair practices prohibited under
Section 5 of the Federal Trade Commission Act and Section 1031 of the Dodd–Frank Act. When
consumers fall victim to fraud or scams, they should have confidence that their bank will comply
with applicable laws when researching potentially fraudulent check, debit, and credit card
transactions, including the provisional credit requirements of the Electronic Fund Transfer Act
(Regulation E) and the billing error requirements of the Truth in Lending Act (Regulation Z).
Second, we’ve seen many banks increase their individual efforts to address fraud. These
efforts include providing bank customers with relevant information about trending scams and
how to avoid them and improving or tightening fraud detection and monitoring systems to
identify potential frauds in a timely manner. I have heard countless stories of bank branch
employees going the extra mile to educate customers about the risks of wiring all their funds to a
suspicious account.
2 Third, several bank trade groups have formed fraud task forces to collaborate and share
information. For example, the American Bankers Association (ABA) has created a check fraud
claim directory,1 which is intended to help banks needing to file a check warranty breach claim
with another financial institution. The Independent Community Bankers of America formed a
check fraud task force of banks and state bankers’ associations and leads a financial sector fraud
working group.2 And Early Warning System (EWS), which operates the bank-owned Zelle
network and was recently cited by the Senate Permanent Subcommittee on Investigations for
various weaknesses,3 has taken steps to further strengthen its fraud detection program.
While these and other initiatives are promising and more needs to be done, banks and
industry trade groups cannot effectively address fraud all by themselves. Take, for instance,
check fraud. The recent rise in check fraud can be traced in large part to bad actors intercepting
checks sent through the U.S. Post Office. To combat this, the ABA and the U.S. Postal
Inspection Service announced a joint effort to combat check fraud in March 2024.4 The joint
initiative focuses on educating U.S. Postal Service and bank customers, addressing money mules
and collusive accountholders, collaborating with law enforcement, and training bank employees
and postal workers on red flags and prevention.
1 American Bankers Association, “ABA Fraud Contact Directory.”
2 Independent Community Bankers of America, “Community Banks Are Fighting Check Fraud on the Front Lines,”
March 20, 2024.
3 See U.S. Senate Permanent Subcommittee on Investigations, Majority Staff Report, A Fast and Easy Way to Lose
Money: Insufficient Consumer Protection on the Zelle Network, July 23, 2024; U.S. Senate, Committee on
Homeland Security and Governmental Affairs, “An Oversight Hearing to Examine How Zelle and the Big Banks
Fail to Protect Consumers From Fraud,” July 23, 2024.
4 American Bankers Association, “ABA and U.S. Postal Inspection Service Announce Partnership to Combat Check
Fraud,” March 19, 2024.
3 Similarly, a significant amount of fraud on peer-to-peer payment platforms originates
from users responding to unsolicited text messages, emails, and social media posts.5 In the
United Kingdom, where liability for such fraud has been assigned to banks, several banking
organizations have established a partnership with Meta, the owner of Facebook, to share
information via a Fraud Intelligence Reciprocal Exchange. While relatively new, reports indicate
that in an early pilot, Meta removed 20,000 scam accounts based on the collaboration.6
In a sign that fraud may be becoming normalized, so-called first party fraud is also on the
rise. Take, for instance, the recent check-kiting social media posts regarding JPMorgan ATMs
that went viral on TikTok. A temporary technical glitch let customers deposit large checks in
ATMs and withdraw funds immediately before the checks could clear. Recent media reports
noted that the bank is investigating thousands of possible check fraud incidents related to this
ATM glitch.7
A laissez-faire view of this might conclude that as long as no laws or regulations are
being violated, elevated levels of fraud may simply be the new normal, the cost of innovation
5 Federal Trade Commission, “Who Experiences Scams? A Story for All Ages,” December 8, 2022. For instance,
according to data from the Federal Trade Commission, in 2021 social media was the single biggest starting point for
scams against Americans ages 18–59; 31 percent of people in that age range who reported losing money to a scam
said that the scheme started on social media. For those ages 18–29, nearly 40 percent of those who reported losing
money to a scam said the scam originated on social media. Among adults 60 years or older, that percentage was 15
percent. See also Payment Systems Regulator Ltd., Authorised Push Payment (APP) Scams Performance Report,
July 2024.
6 PYMNTS, “Meta Teams With UK Banks to Fight Scammers,” October 2, 2024.
7 For example, Payments Dive, “Viral JPMorgan Chase Glitch Is ‘Fraud, Plain and Simple,’ Bank Says,” September
4, 2024; Reuters, “JPMorgan Sues Customers Over Check Fraud Linked to Glitch That Went Viral,” October 28,
2024.
4 and technological advancement. I believe this underestimates the cumulative sense of disorder
and distrust that can emanate from seemingly small but repeated acts of fraud.8
As with many collective action problems, public-private partnerships can be effective.
For instance, coordination and information-sharing efforts focused on cyber risks provide a
useful model for consideration. At the OCC, we are focused on supporting and encouraging these
and other collaborative fraud education and fraud prevention efforts. In addition, we are
regularly engaging with our partners in interagency and international efforts to strengthen
regulatory and supervisory responses to financial fraud. This includes participating in various
working groups with representatives from industry, financial regulators, and law enforcement.
Banks and bank regulators can and will need to do more to address fraud. But they cannot
solve the problem on their own. Social media platforms, telecommunication companies, email
hosts, the U.S. Postal Service, and law enforcement need to step up and do their part as well to
keep the proverbial streets clean, safe, and trusted. The OCC looks forward to continued and
enhanced collaboration with all stakeholders to address this important issue.
8 See The Ezra Klein Show, “The Hidden Politics of Disorder,”, Apple Podcasts, October 18, 2024.
5"
3,website,https://occ.gov/news-issuances/news-releases/2025/nr-ia-2025-53.html,"Federal Bank Regulatory Agencies Seek Comment to Address Payments and Check Fraud | OCC Skip to main content An official website of the United States government Careers Quick Access Most Requested Bank Secrecy Act (BSA) Contact Us Community Reinvestment Act (CRA) Comptroller's Handbook Corporate Application Search Enforcement Action Search Financial Institution Lists Newsroom Third-Party Relationships: Interagency Guidance on Risk Management More OCC Websites BankNet.gov Find resources for bankers. HelpWithMyBank.gov Get answers to banking questions. Careers.occ.gov Join one of the best places to work. Search More Search Tools Financial Institution Search CRA Performance Evaluations Search Enforcement Actions Search Corporate Applications Search (CAS) Home News & Events Newsroom News Release 2025-53 | June 16, 2025 Federal Bank Regulatory Agencies Seek Comment to Address Payments and Check Fraud Share This Page: Joint Release Federal Deposit Insurance Corporation Federal Reserve Board Office of the Comptroller of the Currency The federal bank regulatory agencies today announced a request for comment on potential actions to help consumers, businesses, and financial institutions mitigate risk of payments fraud, with a particular focus on check fraud. For purposes of the request for information, payments fraud generally refers to the use of illegal means to make or receive payments for personal gain, including scams. Because payments fraud may involve multiple institutions and payment methods, no single agency or private-sector entity can address payments fraud on its own. Therefore, the agencies are seeking public comment on discrete actions, collectively or independently, to mitigate payments fraud, including check fraud, within their respective bank regulation and payments authorities. Input is requested on five potential areas for improvement and collaboration: External collaboration among the agencies, Federal Reserve Banks, and industry stakeholders; Consumer, business, and industry education by the agencies and Federal Reserve Banks to educate about payments fraud; Regulation and supervision to mitigate payments fraud, including opportunities the Board may have related to check fraud; Payments fraud data collection and information sharing; and Federal Reserve Banksâ operator tools and services to reduce payments fraud. In addition to seeking public input, the agencies will also continue looking for additional opportunities to effectively collaborate across other state and federal agencies given the importance of interagency coordination to help mitigate payments fraud. Comments must be received within 90 days after date of publication in the Federal Register. Related Link Request for Information on Potential Actions to Address Payments Fraud (PDF) Media ContactsFDICJulianne Fisher Breitbeil(202) 898-6895 FRBLaura Benedict(202) 452-2955 OCCAndrea Cox(202) 649-6870 Topic(s): Bank Secrecy Act & Anti-Money Laundering (BSA/AML) Consumer Protection Fraud & Scams OCC Regulations Payments Systems"
