id,type,link,cleaned_text
21,website,https://occ.gov/news-issuances/bulletins/2024/bulletin-2024-29.html,"Commercial Lending: Refinance Risk | OCC Skip to main content An official website of the United States government Careers Quick Access Most Requested Bank Secrecy Act (BSA) Contact Us Community Reinvestment Act (CRA) Comptroller's Handbook Corporate Application Search Enforcement Action Search Financial Institution Lists Newsroom Third-Party Relationships: Interagency Guidance on Risk Management More OCC Websites BankNet.gov Find resources for bankers. HelpWithMyBank.gov Get answers to banking questions. Careers.occ.gov Join one of the best places to work. Search More Search Tools Financial Institution Search CRA Performance Evaluations Search Enforcement Actions Search Corporate Applications Search (CAS) Home News & Events Newsroom OCC Bulletin 2024-29 | October 3, 2024 Commercial Lending: Refinance Risk Share This Page: ToChief Executive Officers of All National Banks, Federal Savings Associations, and Federal Branches and Agencies; Department and Division Heads; All Examining Personnel; and Other Interested Parties Summary The Office of the Comptroller of the Currency (OCC) is issuing this bulletin to provide banks1 with guidance for managing credit risk associated with refinance risk. This bulletin does not address other risks, such as interest rate risk.2 Recission This bulletin rescinds Banking Bulletin 1993-50, âLoan Refinancing.â Note for Community Banks This bulletin applies to all banks with commercial loans. Highlights This bulletin discusses the effect of refinance risk on credit risk in commercial loan transactions and portfolios. provides guidance on transaction and portfolio-level refinance risk management. Background Refinance risk is the risk that borrowers will not be able to replace existing debt at a future date under reasonable terms and prevailing market conditions. Refinance risk increases in rising interest rate environments and can be amplified by large volumes of loans set to mature in underperforming markets.3 If a borrower cannot refinance under current market conditions, a bank could be burdened with an underperforming or nonperforming loan. Refinance risk primarily affects loans with principal balances remaining at maturity and borrowers who rely on recurring debt to finance their capital structure or business operations. Examples of loan types most affected by refinance risk include interest-only loans, commercial real estate loans,4 leveraged loans, and revolving working capital lines. Fully amortizing loans to sound borrowers generally have lower refinance risk than loans that are not fully amortizing. Refinance risk affects individual loans and portfolios of loans. A concentration in such loans could increase the cost and complexity of problem loan resolutions when borrowers are under stress. In addition, if a significant volume or amount of loans refinance during adverse economic conditions, it could constrain a bankâs capital or liquidity, threaten earnings, or hinder strategic initiatives.5 Refinance risk can be driven by external factors or borrower-specific factors. External factors that affect refinance risk include investor risk appetite and market liquidity; the current interest rate environment; inflation; or supply chain effects on the costs of goods, services, or labor. Refinance risk increases in rising interest rate environments because borrowers may be unable to service their debt at higher interest rates upon refinance. Refinance risk may also increase for some borrowers or portfolios because of declining industry fundamentals or changes in commodity prices. Borrower-specific drivers for heightened refinance risk include high leverage, constrained liquidity, a significant volume of near-term maturities, poor financial performance, or unpopular market sentiment. Guidance Banks should have processes to identify, measure, monitor, and control refinance risk at both the transaction and portfolio levels. The tools to monitor refinance risk should be tailored to the bankâs size, complexity, risk profile, and types of lending. Sound transaction-level credit risk management practices include assessing refinance risk at underwriting, during ongoing monitoring, and near maturity. At the portfolio level, banks should have systems and processes to monitor the volume and cadence of upcoming loan maturities. Independent credit risk review should consider the level of refinance risk when determining an appropriate review scope and assessing credit quality.6 One common method to assess refinance risk at the transaction and portfolio level is multivariable stress testing. Transaction-level stress testing can provide insight into the borrowerâs ability to meet refinancing requirements if the borrowerâs financial condition declines or market conditions deteriorate (e.g., interest rates increase, market terms tighten, expenses increase, or collateral values fall). Portfolio-level stress testing can identify and measure the potential effect of changing market conditions on portfolio segments with higher refinance risk.7 Transaction-Level Risk Management and Risk-Rating Considerations Banks should evaluate refinance risk when approving and structuring loans, during ongoing monitoring (e.g., annual reviews), near loan maturity, and when considering granting extensions or renewals. Refinance risk can also be a factor when risk-rating a loan. A prudent assessment of refinance risk includes a borrowerâs refinancing needs, the performance of the underlying project or asset, the timing of a refinancing transaction (e.g., maturity), the amount and maturity dates of other debt, current market liquidity, and the cost of refinancing. At origination, banks can structure a loan to mitigate refinance risk. For example, underwriting standards may include debt service coverage or loan-to-value requirements that provide a cushion if a borrowerâs financial condition declines or market conditions deteriorate. Banks may also require covenants that preserve the borrowerâs ability to refinance (e.g., leverage covenants or limits on incremental debt) or trigger action before maturity to protect the bank (e.g., debt service coverage ratios or liquidity ratios). During ongoing monitoring and near maturity, management should conduct analysis to determine the borrowerâs refinance requirements and ability to reasonably qualify for another market rate loan to cover the projected outstanding principal. The analysis can also provide insight into the likelihood that a borrower might seek refinancing prior to maturity (e.g., to support significant business expansion, because of a leveraged buyout, or to pay out a retiring partner). Effective analysis of refinance risk includes a loanâs performance compared with expectations at underwriting, the time horizon for a refinance event, borrower-specific factors, and external factors. Analysis should include determining whether a borrower can meet current underwriting standards, including prevailing interest rates, for similar loans. Banks should have refinance plans in place for borrowers with near-term refinancing needs. While market demand could affect a borrowerâs ability to refinance, generally the stronger a borrowerâs underlying financial performance, the more refinance options are available. For loans maturing with an outstanding principal balance or otherwise likely to require near-term refinancing, credit risk ratings should take into account the likelihood that the borrower will be able to obtain refinancing without relying on distressed terms. Refinance risk is just one consideration in determining an appropriate risk rating and should be evaluated in the context of the borrowerâs overall financial condition and debt service ability. While increased refinance risk does not automatically warrant a change in a loanâs risk rating, classification is appropriate when there are well-defined weaknesses that jeopardize repayment. Loans that are adequately protected by the current sound worth and debt service ability of the borrower, guarantor, or the underlying collateral8 generally are not adversely classified.9 Similarly, loans to sound borrowers that are modified in accordance with prudent underwriting standards are generally not adversely classified unless well-defined weaknesses exist that jeopardize repayment. Such loans, however, could be flagged for managementâs attention or for inclusion in designated âwatch lists.â Portfolio-Level Analysis and Risk Management Banks should have processes to identify, measure, monitor, and control refinance risk at the portfolio level. Assessing refinance risk at the portfolio level allows a bank to identify borrowers experiencing similar stresses, whether macroeconomic or specific to an industry or region. Effective processes generally include the ability to identify and monitor the volume and amount of loans maturing with outstanding principal balances and portfolio segments affected by external risk factors. stress-testing to identify portfolios with heightened refinance risk. limits that reflect the bankâs risk appetite. reporting that monitors the level of refinance risk and performance relative to established limits. A bank can mitigate refinance risk by establishing criteria that define when it is appropriate to underwrite loans that will not fully amortize by maturity (e.g., interest-only loans, loans with balloon payments, or revolving loans) and prudent terms for such loans (e.g., re-margining requirements, covenants, or cleanup requirements). Underwriting criteria can also detail the prudent use of interest rate swaps and caps. Banks can further mitigate refinance risk by setting appropriate underwriting exception limits, controls, and reporting (e.g., limiting loans underwritten with covenant-lite structures or with marginal debt service coverage or loan-to-value ratios). Setting and adhering to concentration limits can protect the balance sheet from potential refinancing shocks and bank capital from outsized losses when refinance options are limited. Refinance risk can occur across different lending products, and it is prudent for management to consider whether refinance risk creates correlated exposures not otherwise identified, especially during a deteriorating economic environment.10 Loans Restructured Under a Prudent Loan Workout Plan The OCC encourages banks to work proactively and prudently with borrowers who are, or may be, unable to meet their contractual payment obligations during periods of financial stress. An effective loan workout arrangement should improve the bankâs prospects for repayment of principal and interest, be consistent with sound banking and accounting practices, and comply with applicable laws and regulations.11 Management should consider refinance risk when developing an effective workout strategy. In some cases, as part of a prudent workout plan, a loan originally underwritten with fully amortizing terms is restructured with an outstanding principal payment at maturity. Management should appropriately risk-rate and manage such loans. Management should also measure and monitor the volume of modified and restructured loans. When assessing refinance risk at the portfolio level, management should consider the volume of modified or restructured loans that will no longer fully amortize by maturity. If management determines that a loan refinance represents a modification or accommodation to a borrower experiencing financial difficulty,12 management should perform further analysis to determine whether the loan no longer shares similar risk characteristics with other loans and should be reviewed individually when determining an appropriate allowance for credit loss. Management should also determine whether the loan is collateral-dependent.13 Further Information Please contact Barry Mills, Director for Commercial Credit Risk Policy, at (202) 649-6220. Grovetta N. Gardineer Senior Deputy Comptroller for Bank Supervision Policy 1 âBanksâ refers collectively to national banks, federal savings associations, and federal branches and agencies of foreign banking organizations. 2 For interest rate risk guidance, refer to OCC Bulletin 2010-1, âInterest Rate Risk: Interagency Advisory on Interest Rate Risk Management,â and OCC Bulletin 2012-5, âInterest Rate Risk Management: FAQs on 2010 Interagency Advisory on Interest Rate Risk Management.â 3 A large volume of loans scheduled to mature in an underperforming market is often referred to as a âmaturity wall.â 4 Higher refinance risk is also common in construction and development loans, which are typically interest-only, and other commercial real estate loans, which are generally underwritten to the life of the property, often 15 to 30 years, but mature after a much shorter term, often three to five years. For more information specific to commercial real estate lending, refer to the âCommercial Real Estate Lendingâ booklet of the Comptrollerâs Handbook. 5 Refinance risk can affect a bankâs interest rate risk when a material amount of loans on the balance sheet with higher levels of refinance risk mature at the same time or within a tight time frame. Loans that are unable to refinance at market terms could result in an unplanned asset/liability price mismatch on a bankâs balance sheet. 6 For more information about credit risk review, refer to OCC Bulletin 2020-50, âCredit Risk: Interagency Guidance on Credit Risk Review Systems.â 7 For more information on stress testing, refer to OCC Bulletin 2012-33, âCommunity Bank Stress Testing: Supervisory Guidance,â and OCC Bulletin 2012-14, âStress Testing: Interagency Stress Testing Guidance.â 8 Collateral value alone is not sufficient to preclude adverse classification when well-defined weaknesses are present. Loans that rely on cash flow generating collateral as the primary source of repayment would need to generate sufficient cash flow to repay the debt under reasonable terms. 9 For more information on risk ratings, refer to the âRating Credit Riskâ booklet of the Comptrollerâs Handbook. 10 For more information on concentration risk, refer to the âConcentrations of Creditâ booklet of the Comptrollerâs Handbook. 11 For more information on prudent loan workouts for commercial real estate loans, refer to OCC Bulletin 2023-23, âCredit Administration: Final Interagency Policy Statement on Prudent Commercial Real Estate Loan Accommodations and Workouts.â 12 Loan modifications to borrowers experiencing financial difficulty should be reported in accordance with call report instructions. 13 For more information, refer to OCC Bulletin 2023-11, âCurrent Expected Credit Losses: Interagency Policy Statement on Allowances for Credit Losses (Revised April 2023).â Topic(s): Commercial Credit Credit Underwriting"
22,website,https://occ.gov/news-issuances/news-releases/2022/nr-occ-2022-21.html,"Amanda Freedle Named Deputy Comptroller and Chief Accountant | OCC Skip to main content An official website of the United States government Careers Quick Access Most Requested Bank Secrecy Act (BSA) Contact Us Community Reinvestment Act (CRA) Comptroller's Handbook Corporate Application Search Enforcement Action Search Financial Institution Lists Newsroom Third-Party Relationships: Interagency Guidance on Risk Management More OCC Websites BankNet.gov Find resources for bankers. HelpWithMyBank.gov Get answers to banking questions. Careers.occ.gov Join one of the best places to work. Search More Search Tools Financial Institution Search CRA Performance Evaluations Search Enforcement Actions Search Corporate Applications Search (CAS) Home News & Events Newsroom News Release 2022-21 | March 4, 2022 Amanda Freedle Named Deputy Comptroller and Chief Accountant Share This Page: WASHINGTONâThe Office of the Comptroller of the Currency (OCC) today announced the selection of Amanda Freedle to be the agencyâs next Deputy Comptroller and Chief Accountant. In this role, Ms. Freedle will lead the OCC's efforts for bank accounting and financial reporting, providing accounting counsel to examiners, the banking industry, and the accounting profession. She will assume these duties March 28. âAmanda brings a diverse range of experience to this position,â said Senior Deputy Comptroller for Bank Supervision Policy Grovetta Gardineer. âThe OCC and the federal banking system will benefit from Amandaâs experience and professional expertise.â Ms. Freedle joined the OCCâs Office of the Chief Accountant in January 2009 as a Senior Accounting Policy Advisor, providing accounting support for large bank examination teams and serving as a member of the OCCâs National Retail Risk Committee. She most recently held the position of Deputy Chief Accountant, serving as a key advisor to the Acting Deputy Comptroller and Chief Accountant. Prior to joining the OCC, Ms. Freedle worked in various financial services positions and as an external auditor. She earned an undergraduate degree in business from Wake Forest University and a masterâs degree in accounting from North Carolina State University. Ms. Freedle is a certified public accountant, licensed in North Carolina. Media ContactStephanie Collins (202) 649-6870 Topic(s): Accounting"
23,website,https://occ.gov/news-issuances/bulletins/2020/bulletin-2020-107.html,"Temporary Asset Thresholds: Interim Final Rule | OCC Skip to main content An official website of the United States government Careers Quick Access Most Requested Bank Secrecy Act (BSA) Contact Us Community Reinvestment Act (CRA) Comptroller's Handbook Corporate Application Search Enforcement Action Search Financial Institution Lists Newsroom Third-Party Relationships: Interagency Guidance on Risk Management More OCC Websites BankNet.gov Find resources for bankers. HelpWithMyBank.gov Get answers to banking questions. Careers.occ.gov Join one of the best places to work. Search More Search Tools Financial Institution Search CRA Performance Evaluations Search Enforcement Actions Search Corporate Applications Search (CAS) Home News & Events Newsroom OCC Bulletin 2020-107 | December 2, 2020 Temporary Asset Thresholds: Interim Final Rule Share This Page: ToChief Executive Officers of All National Banks and Federal Savings Associations, Department and Division Heads, All Examining Personnel, and Other Interested Parties Summary On December 2, 2020, the Office of the Comptroller of the Currency (OCC), together with the Board of Governors of the Federal Reserve System (Board) and the Federal Deposit Insurance Corporation (collectively, the agencies), issued an interim final rule to temporarily mitigate transition costs related to the coronavirus (also known as COVID-19) pandemic on community banking organizations, including national banks and federal savings associations, with less than $10 billion in total assets as of December 31, 2019. The rule allows these organizations to use asset data as of December 31, 2019, to determine the applicability of various regulatory asset thresholds during calendar years 2020 and 2021. The OCC also intends to provide similar flexibility to community banking organizations crossing other thresholds in OCC regulations that are not specifically addressed in this rule. Note for Community Banks The rule applies to community banks with total assets of less than $10 billion as of December 31, 2019. Highlights Community banking organizations have played an instrumental role in the nationâs financial response to COVID-19, and many have experienced significant balance-sheet growth as a result of the pandemic and the policy response to it. Much of this growth, particularly that related to participation in the Paycheck Protection Program (PPP), is expected to be temporary. Community banking organizations are subject to a wide range of statutory requirements, regulations, and reporting requirements predicated on their risk profile and asset size. Due to their response to COVID-19, many community banking organizations have been, or may soon be, pushed over an asset threshold that could subject them to additional regulation or to additional reporting requirements. This rule gives community banking organizations more time to either reduce their balance sheets by shedding temporary growth or prepare for higher regulatory and reporting standards. To provide this regulatory burden relief, the rule temporarily changes, for a number of asset-based regulatory thresholds, the date as of when a community banking organization measures its assets for the purpose of determining whether it exceeds a threshold. Specifically, the rule will permit community banking organizations, through December 31, 2021, to determine the applicability of certain asset-based regulatory thresholds using asset data as of December 31, 2019, if the organizationâs assets as of that date were less than its assets on the date as of which the applicability of a given threshold would normally be determined. This means that asset growth in 2020 or 2021 will not trigger new regulatory requirements for these community banking organizations until January 1, 2022, at the earliest. This temporary regulatory burden relief reflects that much of the asset growth since the start of the COVID-19 pandemic, especially growth related to PPP lending, is generally expected to be temporary in nature and therefore likely does not reflect changes in community banking organizationsâ risk profiles. Specifically, the rule provides OCC-supervised institutions with temporary relief from the asset thresholds in the following rules: The $10 billion threshold in the Community Bank Leverage Ratio at 12 CFR 3.12; The $10 billion threshold in the Boardâs debit card interchange fee regulation at 12 CFR 235.5; The $5 billion threshold for eligibility for reduced reporting requirements for the call report at 12 CFR 52.2; and The $3 billion threshold for eligibility for an 18-month examination cycle at 12 CFR 4.6(b) and 4.7(b). Further Information Please contact Kevin Korzeniewski, Counsel, or Alison MacDonald, Special Counsel, Chief Counselâs Office, at (202) 649-5490. Jonathan V. Gould Senior Deputy Comptroller and Chief Counsel Related Link ""Temporary Asset Thresholds"" (PDF) Topic(s): Accounting Bank Operations Call Reports Capital Examination Process Laws & Regulations Midsize & Community Banks Exams"
